{"$schema":"https://json-schema.org/draft/2020-12/schema","$id":"system-audit-event-v1","type":"object","additionalProperties":false,"required":["audit_id","occurred_at","actor_id","actor_type","action","resource_type","resource_id","outcome","request_id","metadata"],"properties":{"audit_id":{"type":"string","minLength":1},"occurred_at":{"type":"string","format":"date-time"},"actor_id":{"type":"string","minLength":1},"actor_type":{"enum":["system_operator","system"]},"action":{"type":"string","minLength":1},"resource_type":{"type":"string","minLength":1},"resource_id":{"type":"string","minLength":1},"resource_version":{"type":["string","null"]},"outcome":{"enum":["succeeded","failed","denied"]},"request_id":{"type":"string","minLength":1},"run_id":{"type":["string","null"]},"job_id":{"type":["string","null"]},"event_id":{"type":["string","null"]},"reason":{"type":["string","null"]},"error_code":{"type":["string","null"]},"before_ref":{"type":["object","null"]},"after_ref":{"type":["object","null"]},"metadata":{"type":"object"}}}
