{"audit_id":"audit-001","occurred_at":"2026-09-02T00:00:00Z","actor_id":"operator-1","actor_type":"system_operator","action":"model.select","resource_type":"model_artifact","resource_id":"lightgbm","resource_version":"1.0.0","outcome":"succeeded","request_id":"request-1","run_id":null,"job_id":null,"event_id":null,"reason":"validated candidate","error_code":null,"before_ref":null,"after_ref":{"logical_uri":"models/lightgbm/1.0.0","sha256":"aaaaaaaaaaaaaaaaaaaaaaaaaaaaaaaaaaaaaaaaaaaaaaaaaaaaaaaaaaaaaaaa"},"metadata":{}}
